cluster_id,size,keywords,fine_topic_label
292,13,"estimation, applications, bayesian, methodology, variance",Bayesian Variance Estimation Applications
293,9,"clusters, cluster, laser, magnetic, atomic",Laser-magnetic atomic clusters
294,11,"pair, temperature, quantum, density, cluster",Quantum Pair Density Clusters
295,7,"experimental, experiments, results, absorption, laser",Laser Absorption Experiments
296,15,"clusters, cluster, energy, response, studied",Clustering Energy Response Studies
297,9,"critical, method, hamiltonian, symmetry, modes",Hamiltonian Symmetry Modes Analysis
298,17,"automata, random, algebraic, regime, model",Random Algebraic Automata Regimes
299,8,"gamma, solution, description, cosmic, angle",Gamma Solution Description
300,6,"atoms, determined, population, wave, state",Atomic Population States
301,10,"market, strategy, portfolio, strategies, risk","""Market Portfolio Risk Strategies"""
302,7,"distributions, problem, bayesian, random, models",Bayesian Random Modeling of Problems
303,14,"core, data, paper, proposed, performance",Data Performance Core Proposal
304,22,"galaxy, galaxies, dark, evolution, observations",Dark Matter Evolution in Galaxies
305,23,"present, algorithm, paper, problem, geometric",Geometric Algorithm for Problem Solving
306,5,"proposed, design, communication, procedure, components",Design Communication Components
307,7,"studies, level, alpha, formula, entropy",Entropy Levels in Study Formulas
308,20,"algorithm, problem, convex, elements, sets",Convex Optimization Elements
309,9,"use, algorithm, knowledge, learning, strategy",Learning Strategies for Knowledge Algorithms
310,24,"learning, algorithm, logic, data, time",Time-Efficient Logic Learning Algorithm for Data Analysis
311,8,"stock, price, wind, mean, transfer",Stock Price Mean Transfer Wind Energy
312,8,"market, financial, optimal, particular, article",Optimal Financial Market Structure
313,10,"points, algorithms, time, query, defined",Time-efficient Query Algorithms
314,12,"galaxies, gravitational, evolution, cosmic, relativity",Cosmic Evolution and Gravitational Relativity
315,14,"statistical, signal, statistics, data, problems",Signal Data Statistics Problems
316,11,"distribution, estimator, regression, parameter, estimators",Estimator Comparison in Regression Models
317,18,"design, exchange, development, market, modeling",Designing Market Models for Exchange Development
318,13,"tool, program, environment, elements, electronic",Electronic Tool Elements in Programming Environments
319,11,"estimator, model, likelihood, estimators, selection",Model Selection for Estimators
320,9,"gas, particles, evolution, thermal, species",Thermal Evolution of Gas Species
321,7,"planets, water, review, elements, linear",Linear Relationships of Water on Planetary Elements
322,16,"data, survey, planets, observations, stellar",Stellar Observations of Planetary Data
323,32,"stars, lambda, velocity, data, stellar",Stellar Velocity Data Analysis
324,10,"lattice, mass, bound, transition, times",Lattice Mass Transition Times
325,16,"class, language, problem, classes, result",Language Classes and Problems
326,7,"atoms, decay, atomic, idea, wave",Atomic Wave Decay Idea
327,13,"energy, phase, flux, produced, observations",Energy Phase Flux Observations
328,45,"data, emission, sources, observations, source",Data-driven emission sources observations
329,7,"lattice, dynamical, calculate, using, mass",Lattice Dynamical Mass Calculation
330,9,"galaxy, mass, cluster, neutral, function",Neutral Gas Function in Galaxy Clusters
331,5,"classification, polarization, description, properties, content",Polarization Properties in Content Classification
332,15,"magnetic, data, images, important, flows",Magnetic Data Flow Analysis of Important Images
333,9,"lattice, cluster, monte, monte carlo, carlo",Monte Carlo Cluster Lattice
334,16,"lattice, coupling, mass, model, simulations",Lattice Coupling Mass Models Simulations
335,5,"rule, idea, language, continuous, average",Continuous Language Rule Analysis
336,10,"scheme, proposed, systems, number, levels",Multi-Level Systems Scheme
337,14,"optical, quadratic, equation, dark, nonlinear",Nonlinear Optical Dark Quadratic Equation
338,6,"programs, geometry, computational, problems, open",Open Computational Geometry Programs
339,22,"language, approach, processing, paper, rules",Language Approach for Paper Processing Rules
340,6,"cost, network, object, networks, complex",Complex network object cost
341,9,"high, hypothesis, model, trading, economic",High Trading Model for Economic Hypothesis
342,24,"policy, paper, use, internet, global",Global Internet Policy Use
343,13,"images, image, algorithm, based, method",Image Algorithm Development
344,23,"equation, parallel, problem, information, sets",Parallel Information Sets Problem Solving
345,32,"computing, systems, automata, complexity, using",Automata Complexity in Computing Systems
346,18,"model, useful, temperature, mean, probabilistic",Probabilistic Mean Temperature Model
347,6,"internet, access, regulatory, paper, services",Regulatory Internet Services Access
348,13,"policy, data, query, management, index",Data-Driven Policy Management
349,7,"internet, law, policy, network, information","""Internet Law and Network Policy"""
350,17,"beam, pattern, method, generation, radiation",Beam Radiation Pattern Generation Method
351,11,"water, global, period, number, variation",Global water number variation period
352,20,"frequency, using, design, demonstrate, structures",Designing Frequency Structures
353,6,"high, parameters, pattern, beam, design",High-beam pattern design parameters
354,6,"beam, energy, particle, simulation, linear",Linear Particle Beam Energy Simulation
355,9,"proposed, band, large, negative, elements",Large Negative Elements Band Proposal
356,9,"frequency, liquid, wave, efficiency, optical",Optical Liquid Wave Efficiency
357,19,"data, database, query, management, information",Information Retrieval Techniques in Databases
358,5,"optimal, problem, constraint, model, utility",Optimal Utility Model for Constrained Problems
359,5,"option, value, asset, management, options",Option Value Management
360,22,"pricing, volatility, prices, risk, market",Market Price Volatility Risk
361,15,"optimal, prices, stochastic, equation, problem",Stochastic Optimal Pricing Problem
362,15,"image, distributed, database, algorithm, time",Distributed Image Databases Algorithm Design
363,8,"grid, information, distributed, selection, objects",Distributed Information Selection for Objects in Grid Computing
364,15,"risk, stock, market, model, trading",Stock Market Risk Models for Trading
365,9,"parallel, software, model, economic, fit",Parallel Economic Software Models Fitting
366,5,"market, graph, trading, law, price",Market Graph Trading Laws
367,6,"nuclear, particle, behavior, indicate, energy",Particle Energy Behavior
368,28,"utility, portfolio, risk, default, market",Portfolio Risk Management
369,8,"model, price, trading, information, market",Market Trading Model with Price Information
370,7,"time, average, stock, market, financial",Financial Market Time Averages
371,6,"risk, portfolio, differences, distribution, ratio",Risk Ratios in Portfolio Distributions
372,10,"default, trading, market, stock, financial",Stock Market Default Trading
373,7,"energy, flow, target, mass, particles",Energy Flow in Target Mass Particles
374,6,"automata, cellular, map, work, reversible",Reversible Cellular Automata Maps
375,15,"group, algorithm, function, paper, problem",Optimizing Group Algorithms for Function Solving
376,12,"layer, temperature, computing, networks, time",Temperature-Dependent Computing in Layered Networks
377,25,"patterns, dynamics, nonlinear, waves, equations",Nonlinear Wave Patterns Dynamics
378,7,"control, based, used, useful, data",Data-Based Control Strategies
379,18,"digital, content, information, paper, scientific",Digital Scientific Information Content Management
380,21,"graph, software, algorithm, number, graphs",Graph Software Algorithm
381,9,"charge, signal, reaction, measurement, measured",Charge Measurement in Chemical Reactions
382,12,"volatility, model, price, optimal, risk",Optimal Volatility Modeling for Price Risk
383,6,"access, services, implementation, information, current",Current Access Services Implementation
384,18,"grid, services, distributed, management, computing",Grid-based Distributed Computing Management Services
385,12,"scheme, molecular, technology, setting, transmission",Molecular Transmission Scheme
386,10,"result, problem, algorithm, probability, algorithms",Probabilistic Algorithms for Problem Solving
387,20,"time, problem, algorithm, algorithms, search",Optimization of Search Algorithms for Time-Based Problems
388,26,"flow, equations, solutions, method, considered",Flow Equations Solutions Method
389,7,"algorithm, time, pricing, memory, point",Time-efficient Pricing Algorithm for Memory-intensive Point Operations
390,9,"data, power, structure, algorithms, sources",Data Structure Algorithms Sources
391,7,"hierarchy, orthogonal, distribution, universal, classification",Universal Orthogonal Classification Hierarchy
392,5,"generalized, recently, solutions, prove, proposed",Generalized Proposed Solutions for Recent Challenges
393,11,"price, stock, market, financial, distribution",Stock Market Financial Distribution
394,6,"function, dynamics, structure, em, stock",Stock Function Dynamics
395,9,"information, region, distribution, phase, laser",Laser Phase Distribution in Regions
396,16,"model, power, condition, computational, control",Modeling Power Conditions for Computational Control
397,19,"systems, periodic, map, models, maps",Periodic System Maps
398,8,"maps, systems, scalar, interaction, dynamical",Dynamical Scalar Interaction Maps
399,9,"resonance, representation, hierarchy, type, lattice",Hierarchical Lattice Representation of Resonance Types
400,9,"automata, cellular, models, local, obtained",Cellular Automata Models
401,12,"automata, cellular, entropy, rules, systems",Cellular Automata Rule Systems Entropy
