cluster_id,size,keywords,fine_topic_label
0,5,"regression, reduction, dimension, principal, methodology",Principal Component Regression Methodology
1,9,"design, model, information, process, constraints",Designing Information Models for Process Constraints
2,9,"planets, formation, radial, mass, solar",Radial Solar Planet Mass Formation
3,14,"galaxies, stellar, mass, galaxy, evolution",Galaxy Mass Evolution
4,6,"noise, experiment, tree, binary, dynamical",Binary Dynamical Tree Experiment
5,9,"statistics, statistical, research, applied, numerical",Applied Statistical Research in Numerical Methods
6,12,"distortion, radial, information, model, accuracy",Radial Distortion Model Accuracy
7,8,"alpha, returns, exists, positive, negative",Risk-adjusted returns
8,7,"dark, energy, matter, constraints, early",Early Dark Energy Constraints
9,8,"genes, gene, expression, regions, set",Gene Expression Regions Set
10,18,"gene, species, expression, genes, regulatory",Gene Regulation in Species Expression
11,9,"estimators, nuclear, computation, cells, better",Improved Nuclear Computation for Cell Simulation
12,6,"water, higher, galaxies, using, radio",Radio Observation of Galaxies in Water
13,17,"magnetic, magnetic field, field, plasma, particle",Magnetic Plasma Particle Interaction
14,7,"solar, cells, learning, high, cell",Solar cell learning for high efficiency
15,6,"learning, algorithms, models, networks, algorithm",Learning Network Algorithms
16,11,"vacuum, particles, speed, critical, cosmic",Critical Speed of Cosmic Particles in Vacuum
17,12,"emission, xray, radio, wind, sources",X-ray and Radio Wind Sources
18,7,"world, wind, effects, times, considered",World Wind Effects
19,6,"surfaces, structures, ring, functions, map",Ring Structures on Surfaces
20,6,"smooth, minimal, groups, exist, topology",Minimal Group Topology
21,8,"characteristic, classes, connection, manifold, vector",Vector Classes on Manifolds
22,11,"graphs, graph, finite, class, given",Graph Classification
23,6,"graph, algorithm, graphs, implemented, original",Graph Algorithm Implementation of Original Design
24,5,"treatment, effects, average, binary, effect",Binary Effects of Average Treatment
25,7,"monte carlo, monte, carlo, methods, markov",Monte Carlo Monte Carlo
26,5,"cell, cells, states, dynamics, different",Cell state dynamics in different cells
27,8,"response, total, solar, content, electron",Solar Electron Content Response
28,12,"hierarchy, polynomial, operator, classes, query","""Polynomial Operator Classes for Query Hierarchy"""
29,13,"functions, curvature, manifold, manifolds, special",Special Manifold Functions Curvature
30,6,"gravitational, radiation, relativity, universe, general",Gravitational Relativity in the Universe
31,20,"polynomials, orthogonal, coefficients, measure, points",Orthogonal Polynomial Coefficients Measurement
32,5,"transport, model, computer, performance, process",Computer Transport Model Performance
33,7,"digital, information, object, objects, years",Digital Information Objects Over Time
34,10,"product, let, algebras, operator, estimate",Operator Estimation in Product Algebras
35,14,"et, et al, al, angle, regression",Angle Regression Analysis
36,5,"cross, section, momentum, measured, detected",Cross-sectional Momentum Measurement
37,7,"polarization, solar, observations, magnetic, linear",Linear Solar Polarization Observations
38,5,"number, bound, formula, answer, degree",Bound Formula Degrees
39,9,"dna, sequences, correlations, regions, software",DNA Sequence Correlations in Specific Regions
40,20,"category, symmetric, spectra, construction, maps",Symmetric Spectra Construction Maps
41,5,"review, version, science, section, larger",Larger Version of Science Review Sections
42,7,"pm, events, charged, delta, basis",Charged Particle Events on Delta Basis
43,12,"languages, language, regular, complexity, version",Language Regularity Complexity Versions
44,6,"database, data, information, query, control",Database Query Control
45,5,"matrix, omega, exponential, algebras, minimal",Omega Exponential Algebras in Minimal Matrix Structures
46,113,"functions, theorem, series, analytic, function",Analytic Function Series
47,6,"clusters, electronic, cluster, density, structures",Electronic Cluster Structures Density
48,9,"metric, manifold, complex, finite, space",Complex Finite Metric Spaces
49,8,"human, molecular, features, expressed, problem",Molecular Human Features Expressed in Problems
50,7,"nuclear, radiation, effect, relativistic, ground",Ground-level Radiation Effects in Nuclear Accidents
51,7,"let, closed, topology, space, compact",Compact Spaces Topology
52,7,"minimal, ideal, classes, maps, components",Minimal Ideal Class Maps
53,5,"techniques, exists, proof, action, lambda",Lambda Calculus Techniques Proof
54,9,"stars, star, formation, lambda, mass",Star formation processes and lambda mass distribution
55,18,"protein, proteins, experimental, structures, sequence",Protein Structures Sequencing
56,12,"proteins, dna, length, model, protein",Protein length modeling
57,5,"decomposition, hamiltonian, short, quantum, weak",Decomposition Hamiltonian Short
58,6,"proof, density, problem, series, conjecture",Density Conjecture Proofs
59,9,"weight, algebras, lie, representation, generated",Weight-Generated Lie Algebras' Representation
60,5,"short, result, set, gives, generated",Generated Results Set
61,9,"complexity, core, generic, theory, use",Generic Complexity Theory Use
62,13,"space, spaces, sequence, let, real",Real Space Sequences
63,7,"scaling, prove, space, gaussian, function",Gaussian Function Scaling in Space
64,5,"plane, space, problem, method, exponential",Exponential Method for Plane Problems in Space
65,15,"regular, prove, space, formula, pairs",Regular Space Formulas for Pair Properties
66,9,"genetic, code, shape, human, parameter",Genetic Shape Coding in Humans
67,39,"cell, cells, spaces, sequence, genes",Cell Spaces Sequence Genes
68,8,"group, manifold, distance, flows, closed",Closed Group Manifold Flows
69,18,"cell, cells, model, mathematical, article",Cell Model Mathematical Study
70,9,"cells, biological, pattern, space, model",Biological Cell Patterns in Space Model
71,10,"operator, bounded, operators, point, space",Bounded Operator Point Space
72,7,"logic, example, probability, generalized, new",Generalized New Probability Logic Example
73,5,"maps, quadratic, generalized, cases, particular",Generalized Quadratic Mapping Cases
74,63,"operators, rings, theory, matrix, matrices",Matrix Ring Theory
75,8,"hamiltonian, space, group, systems, symplectic",Symplectic Space Groups in Quantum Systems
76,10,"symplectic, hamiltonian, manifolds, group, curves",Hamiltonian Group Curves on Manifolds
77,14,"estimator, procedure, model, matrix, linear",Linear Model Estimation Procedure
78,7,"network, networks, model, digital, degree",Digital Network Degree Model
79,28,"motion, process, vector, random, space",Random Vector Motion in Space
80,6,"alpha, equivalence, given, sigma, functions",Equivalence of Functions with Sigma and Alpha
81,9,"minimal, algebras, algebra, representation, map",Minimal Algebra Representations
82,14,"sites, control, minimal, probability, state",Minimal Control Sites Probability
83,6,"omega, set, real, lambda, random","""Omega Set Properties of Lambda Random Variables"""
84,5,"critical, internal, consistent, prove, universal",Prove Universality of Internal Consistency
85,7,"particle, plane, quantum, equations, coupling",Quantum Plane Particle Coupling Equations
86,6,"equation, type, solutions, cycle, surfaces",Equation Cycle Surface Solutions
87,7,"formula, mechanics, integral, dynamic, gamma",Dynamic Gamma Integral Mechanics
88,5,"code, channel, improve, optimal, minimum",Optimal Code for Minimum Channel Improvement
89,34,"channel, error, input, cohomology, prove",Error Proofing Input Channels
90,22,"systems, method, paper, models, mathematical",Mathematical Modeling Systems
91,9,"control, laws, family, matching, dimensional",Dimensional Family Matching Laws
92,11,"channels, capacity, schemes, gaussian, information",Gaussian Capacity of Information Channels
93,33,"omega, model, let, theory, algebra",Algebraic Omega Models
94,10,"operators, differential, spectral, operator, decomposition",Operators Differential Spectral
95,19,"estimator, distribution, poisson, function, asymptotic",Asymptotic Poisson Estimator Function
96,14,"symplectic, cohomology, manifold, space, compact",Cohomology of Compact Manifolds
97,6,"manifolds, symplectic, connected, constructed, illustrate",Symplectic Manifold Construction
98,14,"equations, smooth, methods, method, simple","""Simple Smooth Methods for Solving Equations"""
99,5,"invariant, group, performance, shown, defined",Invariant Group Performance Definition
100,5,"pricing, consider, allow, large, market",Competitive Pricing in Large Markets
101,13,"sequences, integer, polynomial, general, theory",Integer polynomial sequences theory
102,7,"algorithm, language, new, algorithms, given",New Language Algorithms
103,18,"problem, answer, completely, sets, function",Sets and Functions
104,7,"manifold, hyperbolic, manifolds, closed, provided",Hyperbolic Closed Manifolds Provision
105,11,"representations, lie, algebra, measure, group",Lie Group Representations
106,24,"category, notion, polynomials, theory, theorem",Polynomial Theories and Notions
107,6,"tree, graph, spaces, related, rational",Rational Graph Spaces
108,12,"category, weak, products, groups, notion",Weak Product Groups Notion
109,13,"theory, theorem, definition, considered, basic",Basic Theory Development
110,17,"networks, model, dna, proteins, network",DNA Protein Network Model
111,6,"group, graph, product, let, free",Graph Product Properties
112,16,"group, groups, product, extension, structure",Group Product Extensions
113,19,"proof, theorem, mathematical, paper, hypothesis",Mathematical Proof Theorem Hypothesis
114,12,"game, electronic, natural, case, sequence",Natural Game Sequences
115,6,"ring, conjecture, finite, local, let",Local Finite Ring Conjecture
116,8,"numerical, accuracy, scheme, algorithm, method",Numerical Accuracy Scheme
117,7,"approximation, explicit, numbers, code, nonlinear",Nonlinear Approximation Coding
118,14,"ring, let, functions, polynomial, positive",Positive Polynomial Functions on Rings
119,10,"algebras, representations, algebra, differential, integral",Differential Algebra Representations
120,26,"groups, hyperbolic, group, finitely, free",Hyperbolic Finite Free Groups
121,17,"curve, points, fields, forms, critical",Critical Point Forms in Curved Fields
122,23,"spaces, quantum, algebra, group, space",Quantum Algebraic Groups in Spaces
123,13,"maps, map, essential, delta, space",Mapping Essential Delta Regions in Space
124,14,"cohomology, algebra, differential, algebras, forms",Differential Algebraic Forms
125,7,"topological, space, subset, recent, aim",Recent Topological Subset Analysis
126,9,"space, constructed, subset, contains, compact",Compact Space Subsets
127,5,"physics, impact, database, social, world",Database Physics Impact on Social World
128,6,"algebra, construct, connected, linear, structure",Linear Algebra Structure Construction
129,35,"algebras, algebra, lie, groups, group",Lie Algebra Groups
130,6,"issues, wave, study, scalar, electrons",Scalar Wave Study on Electron Issues
131,16,"plasma, images, grid, database, computer",Plasma Image Processing on Computers
132,7,"universe, presented, higher, spin, molecules",Higher Spin Molecules in the Universe
133,7,"plasma, stable, particles, body, size",Stable Plasma Particle Size in the Human Body
134,8,"phase, transition, magnetic, matrix, regime",Magnetic Matrix Phase Transition Regime
135,10,"plasma, wave, radio, temperature, equation",Radio Plasma Wave Temperature Equation
136,10,"plasma, equation, obtained, waves, wave",Plasma Wave Equations
137,7,"decision, quantum, operator, particle, condition",Quantum Particle Decision Operators
138,6,"plasma, transition, electron, equation, background",Plasma Transition Equations
139,7,"plasma, electrons, distribution, beam, equation",Plasma Electron Beam Distribution Equation
140,13,"physics, quantum, article, mechanics, classical",Quantum Mechanics Article
141,17,"plasma, period, physics, theories, review",Plasma Theories Review Period
142,16,"space, hamiltonian, dimensional, equation, solutions",Hamiltonian Equations in Higher Dimensions
143,20,"cohomology, groups, equations, compute, equation",Cohomology Computation for Equation Groups
144,11,"sequence, science, spectral, scientific, fixed",Spectral Analysis of Fixed Sequences in Science
145,21,"equations, solutions, equation, solution, smooth",Smooth Equation Solutions
146,15,"operators, equations, shown, equation, differential",Differential Equation Operators
147,5,"particular, spectra, theorem, cohomology, equal",Equal spectra theorem in cohomology
148,5,"spaces, degree, complex, particular, models",Complex Spaces Models for Specific Degrees
149,10,"vector, manifold, complex, proof, space",Complex Vector Spaces Proofs
150,12,"complete, space, ring, variety, prove",Complete ring varieties
151,5,"equivalent, algebras, operations, differential, groups",Differential Group Algebras Operations
152,9,"spaces, characteristic, embedded, formulas, compute",Embedded Spaces Formulas Computation
153,6,"agents, networks, different, trading, game",Trading agents in network games
154,5,"statistics, network, stability, models, factors",Statistics Network Stability
155,7,"control, role, patterns, group, networks",Network Control Patterns in Groups
156,6,"networks, graph, law, model, database",Graph Law Modeling in Network Databases
157,14,"networks, network, time, signals, motion",Signals in Moving Networks
158,10,"network, networks, theory, protein, systems",Protein Network Systems Theory
159,10,"authors, paper, response, changes, state",Response Changes in State of Papers by Authors
160,6,"paper, form, cellular, networks, genetic",Genetic Networks in Cellular Forms
161,9,"effects, behavior, mechanism, sequence, pressure",Pressure Mechanism Behavior Sequence
162,6,"data, model, method, sets, new",New Data Model Methods
163,5,"potential, biological, linear, recent, results",Linear Biological Potential Results
164,8,"species, level, values, levels, light",Light Levels in Species Evolution
165,5,"model, simulations, mean, stable, population",Modeling Stable Population Mean in Simulations
166,13,"reversible, logic, computing, proposed, quantum",Quantum Reversible Logic Computing
167,7,"model, allows, protein, dynamics, algorithms",Protein Dynamics Algorithms Modeling
168,7,"surface, velocity, flow, fluid, angular",Angular Fluid Flow Velocity on Surface
169,16,"molecular, transition, particle, method, frequency",Molecular Transition Frequency
170,7,"classical, motion, equations, law, new",New Classical Motion Equations
171,7,"human, change, molecules, dna, model",DNA Molecule Changes in Human Models
172,9,"curve, different, human, scattering, dimension",Human Scattering in Multidimensional Curves
173,6,"scales, density, functional, computational, calculation",Functional Scales Computation
174,6,"positive, detector, area, channels, feedback",Positive Feedback in Detector Channels
175,10,"equations, solutions, mass, gravitational, energy",Gravitational Energy Solutions
176,14,"motion, classical, wave, particle, potential","""Classical Particle Motion"""
177,14,"flow, fluid, equations, basic, boundary",Boundary Equations of Fluid Flow
178,5,"field, integral, vacuum, consequence, classical",Field Integral Consequence in Classical Vacuum
179,9,"method, presented, monte, monte carlo, carlo",Monte Carlo Method Presentation
180,5,"likelihood, approach, conventional, probability, cases",Conventional Approach Probabilities in Cases
181,9,"variations, layer, increase, object, maximum",Maximum Layer Variations in Objects
182,12,"memory, power, constraints, differential, tool",Differential Power-Constrained Memory Tool
183,14,"equation, flows, proposed, fluid, scales",Fluid Scale Flows Equation
184,5,"surfaces, calculation, program, nonlinear, equations",Nonlinear Surface Calculation Program
185,13,"correlation, diffusion, field, observed, methods",Diffusion Field Correlation Methods
186,20,"new, nuclear, matter, physical, energy",Nuclear Energy Matter Transformation
187,10,"relativistic, symmetry, physical, quantum, metric",Quantum Relativistic Symmetry Metric
188,5,"laser, simple, establish, phenomena, boundary",Laser Boundary Phenomena Simplification
189,8,"light, data, velocity, structure, available",Data Velocity in Light Structures
190,5,"velocity, distributions, lower, obtained, model",Lower Velocity Distributions Model
191,8,"surface, theories, scattering, clusters, cluster",Surface Theories Scattering
192,7,"spectrum, model, accuracy, optical, models",Optical Accuracy Models
193,6,"distributions, electronic, methods, method, functional",Functional Electronic Distributions
194,8,"results, particles, elementary, phase, theories",Elementary Particle Phases in Theories
195,67,"field, nonlinear, mode, laser, optical",Optical Nonlinear Modes in Field Lasers
196,8,"algorithm, method, single, lattice, basis",Algorithm Method Single
197,7,"method, demonstrated, algorithm, data, noise",Reducing Noise in Data using Algorithm
198,20,"distribution, method, information, bayesian, approach",Bayesian Information Distribution Method
199,7,"gaussian, problems, discrete, likelihood, layer",Gaussian Layer Discrete Problems
200,5,"atoms, theoretical, physics, wave, magnetic",Magnetic Wave Theory in Atomic Physics
201,8,"laws, work, natural, theory, relativity",Natural Laws of Work in Relativity Theory
202,5,"research, scientific, universe, operations, atomic",Atomic Universe Operations
203,12,"optimization, future, results, human, rate",Human Optimization Rates
204,10,"matrix, resolution, approach, spectrum, diffusion",Matrix Spectrum Analysis Approach
205,7,"wave, parameters, scale, scattering, pressure",Wave Scattering Parameters at Different Scales
206,9,"motion, shape, energy, curvature, free",Energy-based Motion of Curved Shapes
207,10,"known, view, various, previously, transformation",Transformation Views in Various Known Fields
208,10,"energy, charge, collection, efficiency, detector",Efficiency of Charge Collection in Energy Detectors
209,9,"science, social, relations, terms, small",Small Social Relations Terms
210,12,"states, molecules, bound, free, model",Molecular State Models
211,5,"signals, current, logic, patterns, input",Pattern Recognition in Logic Circuits
212,7,"high, solar, source, electron, production",High Solar Electron Production
213,5,"xray, relative, flux, measurements, intensity",X-ray flux measurements and intensity relative to standard
214,10,"calculations, clusters, structure, transition, different",Transition structures in different clusters
215,11,"band, spin, model, interaction, temperature",Spin-Band Interaction Model at Different Temperatures
216,11,"available, energy, curves, smooth, formation",Energy Smooth Curves in Formation
217,6,"states, spectrum, dimension, analytically, molecular",Molecular State Spectrum Analysis
218,5,"data, methods, digital, different, radio",Digital Differentiation of Radio Data
219,5,"automata, finite, regular, languages, states",Finite State Automata for Regular Language Analysis
220,19,"quantum, electron, fluctuations, transmission, systems",Quantum Electron Fluctuations in Transmission Systems
221,14,"spin, field, phase, mean, random",Spin Field Phase Mean Random Distribution
222,7,"random, transition, interaction, dynamics, potential",Random Interaction Dynamics in Potential Systems
223,7,"current, calculated, electrons, quantum, formula",Current Calculated Electrons
224,12,"quantum, states, electrons, interaction, field",Quantum Electron Interaction Fields
225,13,"energy, model, nuclear, scattering, true",True Nuclear Scattering Model
226,5,"economic, formal, law, probability, study",Economic Probability Study of Formal Laws
227,19,"policy, model, optimal, conditional, long",Policy Optimization for Long-term Conditional Models
228,29,"atoms, scattering, resonance, gas, atomic",Atomic Gas Resonant Scattering
229,26,"mechanisms, agents, choice, energy, model",Energy Agent Selection Mechanisms
230,16,"lattice, agents, choice, equilibrium, assumptions",Lattice Agents Equilibrium Choices
231,10,"potentials, leads, model, cross, section",Cross-sectional Model Analysis
232,7,"model, ring, variations, signal, produced",Ring Signal Produced Variations Model
233,10,"cell, proteins, field, oscillations, channels",Protein Oscillations in Cellular Channels
234,9,"memory, long, process, low, amplitude",Long-term Memory Processing with Low Amplitude
235,8,"fluctuations, interactions, study, noise, velocity",Velocity Fluctuations in Interacting Systems
236,6,"phase, fluctuations, density, states, coherent",Coherent Phase Fluctuations in Dense States
237,14,"optical, onedimensional, parameter, phase, lattice",One-Dimensional Optical Lattice Phase
238,7,"interaction, optical, atoms, lattice, beam",Optical Atom Lattice Interaction
239,12,"spin, gap, coupling, model, phase",Spin-Gap Coupling Model Phases
240,7,"treatment, growth, following, significantly, significant","""Significantly Improved Growth with Treatment"""
241,9,"coupled, cell, propose, periodic, pressure",Coupled Cell Pressure Periodic Proposal
242,14,"atoms, theory, oscillations, interaction, frequencies",Atomic Oscillation Interactions
243,13,"atoms, scattering, modes, mode, experimentally",Experimental Atomic Scattering Modes
244,9,"activity, parameters, model, chemical, rates",Chemical Reaction Rates Modeling
245,13,"cell, model, make, cells, oscillations",Cellular Oscillation Modeling
246,9,"data, economic, distribution, effects, component",Economic Data Distribution Effects
247,13,"effects, problem, empirical, sample, differential",Differential Effects of Problem on Empirical Sample
248,7,"neutral, charged, measured, measurements, detector",Neutral Charged Measured
249,31,"model, critical, phase, transition, finite",Finite Phase Transition Model
250,5,"normal, current, transition, frequency, temperature",Thermal Transition Frequency Normalization
251,13,"temperature, effect, gap, discussed, phase",Phase gap effect on temperature
252,13,"field, theories, energy, algebras, dimensions",Field Theories in Energy Algebras Across Dimensions
253,5,"propagation, lattice, molecules, numerical, surface",Numerical Molecular Propagation on Surface Lattices
254,13,"theory, surfaces, model, topological, field",Topological Surface Models
255,15,"theory, states, quantum, dimensional, gravity",Quantum Dimensional States of Gravity
256,26,"word, model, surface, energy, calculations",Surface Energy Model Calculations
257,6,"interaction, shown, critical, temperature, spin",Critical Interaction Temperature Spin
258,8,"surface, behavior, phase, negative, problem",Negative Surface Behavior in Phase Change
259,6,"domain, important, analysis, choice, output",Domain-Based Choice Analysis for Output Optimization
260,12,"domain, equivalent, equilibrium, agents, effect",Equilibrium Agents' Domain Effects
261,11,"carlo, monte carlo, monte, pricing, dual",Monte Carlo Pricing Dual Carlo
262,18,"method, carlo, model, options, risk",Risk Model Options
263,12,"method, sampling, data, methods, simulation",Simulation Methods in Data Analysis
264,8,"scale, scaling, scales, models, surface",Surface Scaling Models
265,18,"length, critical, near, fluid, model",Near-critical Fluid Modeling
266,10,"distribution, matching, estimation, estimator, model",Distribution Matching Estimators
267,11,"equilibrium, new, power, cost, research",New Power Equilibrium Cost Research
268,13,"quantum, states, method, discussed, integral",Quantum State Integral Method
269,10,"quantum, mechanics, classical, information, measurement",Quantum Information Measurement
270,10,"correlations, momentum, approach, input, omega","""Omega Momentum Input Correlations"""
271,14,"products, model, economic, case, equilibrium",Product Model Economic Equilibrium Case Study
272,6,"data, uncertainty, dimension, algorithm, techniques",Dimensional Uncertainty Algorithms
273,14,"data, methods, bayesian, algorithms, method",Bayesian Algorithm Development
274,9,"quantum, interpretation, nonlinear, experiment, mechanics",Quantum Nonlinear Interpretation Experiment
275,6,"models, procedure, framework, spaces, known",Modeling Known Procedures in Spaces
276,5,"algorithm, distance, problems, language, time","""Efficient Algorithmic Language for Distance Problems"""
277,6,"optimal, basis, points, matching, accuracy",Optimal Basis Matching Accuracy
278,10,"algorithm, matrices, computational, estimators, various",Computational Matrix Algorithms
279,7,"curvature, states, defined, theory, quantum",Quantum Curvature Theory
280,10,"flux, temperature, production, particular, physics",Particle Production Flux in Physics
281,12,"search, production, generation, presented, limits",Search limits in production generation
282,15,"data, population, expression, model, estimates",Predicting Population Expression Data with Models
283,10,"spatial, quantum, information, distribution, connection",Quantum Spatial Information Distribution
284,15,"quantum, relativity, mass, gravity, major",Quantum Gravity Major Breakthroughs
285,7,"estimator, networks, bayesian, expressed, population",Network Bayesian Population Estimation
286,11,"models, data, methods, time, parameters",Long-term Model Analysis using Data and Parameters
287,12,"theory, symmetry, models, vacuum, symmetric",Symmetric Vacuum Models
288,11,"solutions, gravity, theory, field, equations",Gravity Field Equations Solutions
289,15,"order, state, levels, decay, resonance",Decay Levels in Resonant States
290,10,"agents, risk, price, internal, model",Risk-based Pricing Models for Agents
291,12,"models, feature, graph, features, data",Graph Feature Models in Data Analysis
